{"assumptions":[{"basis":"Assumption. The ledger has no cost data; 0.60 is a placeholder typical of wholesale gift-ware.","id":"cost_ratio","label":"Unit cost as a share of selling price","range":[0.3,0.9],"unit":"share","value":0.6},{"basis":"Assumption. Value recovered per unsold unit (clearance).","id":"salvage_ratio","label":"Salvage value as a share of unit cost","range":[0.0,0.6],"unit":"share","value":0.2},{"basis":"Assumption. One stocking decision per Monday week, no carry-over of stock.","id":"review_period","label":"Review period","range":[1,1],"unit":"week","value":1},{"basis":"Assumption. Stock arrives before the week starts; no lead-time demand uncertainty.","id":"lead_time","label":"Replenishment lead time","range":[0,0],"unit":"weeks","value":0},{"basis":"OBSERVED: family average selling price (revenue / units) or SKU median unit price from the ledger.","id":"price","label":"Selling price","range":[1.0,1.0],"unit":"share of observed price","value":1.0}],"disclaimer":"SIMULATED. Costs and salvage are assumptions, not data. Demand is OBSERVED (last 52 weeks) and PREDICTED (next-week forecast from mean4 with its backtest error as sigma). The output is a what-if, not advice.","formula":{"critical_fractile":"cf = (p - c) / (p - s)","empirical":"Q* = smallest sample d with F(d) >= cf; E[sales] = mean(min(d, Q))","normal":"Q* = max(0, mu + sigma * Phi^-1(cf)); demand = max(D, 0); L(z) = phi(z) - z (1 - Phi(z)); E[sales] = sigma (L(-mu / sigma) - L(zq)), zq = (Q - mu) / sigma; shortage = sigma L(zq)","profit":"profit = p E[sales] - c Q + s (Q - E[sales])"},"items":[{"forecast_next_week":18624.5,"forecast_sd":3909.3229148388527,"id":"family:Bags and purses","kind":"family","label":"Bags and purses","mean_weekly_units":12129.538461538461,"price_gbp":1.6945,"sd_weekly_units":4788.9161877604065,"weekly_units_sample":[9274,6365,3540,0,9929,8663,6795,5950,7464,4020,9396,8846,6113,8794,12729,10723,15340,8146,12462,7858,6851,9283,22168,13969,13940,9774,12798,13583,13401,14071,15847,9420,15984,13416,16435,18958,15194,17185,10467,13978,14387,18097,12298,20382,11545,12313,14280,13807,23297,19119,14999,17083],"weeks":52},{"forecast_next_week":1448.0,"forecast_sd":411.12876593942593,"id":"family:Bath and personal care","kind":"family","label":"Bath and personal care","mean_weekly_units":1082.7884615384614,"price_gbp":2.122,"sd_weekly_units":402.7045497310122,"weekly_units_sample":[1533,1464,1237,0,1178,803,1023,738,1147,794,639,741,683,1648,747,1121,1205,645,1409,736,641,1047,1362,982,1196,659,1411,1130,629,1366,1052,1474,1206,655,574,1867,872,1368,647,1544,725,1987,822,1457,766,1500,836,1247,1059,1225,1646,1862],"weeks":52},{"forecast_next_week":10399.0,"forecast_sd":1500.2180262619675,"id":"family:Candles and fragrance","kind":"family","label":"Candles and fragrance","mean_weekly_units":6862.615384615385,"price_gbp":1.4371,"sd_weekly_units":2354.265791663696,"weekly_units_sample":[11225,10601,2426,0,6843,10182,5498,5430,5571,3964,5531,7257,5788,5366,5100,6084,5005,5679,5322,8187,5891,8427,8794,9675,6900,4923,7220,6241,5681,4606,5454,5792,6935,4953,5362,5522,5675,5909,6433,6390,7707,8994,5626,7082,7326,8445,12177,10061,9604,11457,10849,9686],"weeks":52},{"forecast_next_week":1667.75,"forecast_sd":687.8976129664553,"id":"family:Garden and outdoor","kind":"family","label":"Garden and outdoor","mean_weekly_units":1696.1538461538462,"price_gbp":2.5997,"sd_weekly_units":770.504300979595,"weekly_units_sample":[1318,869,582,0,1711,1209,1825,1414,1153,1466,1278,2220,1430,1437,2247,2927,2961,1966,2719,2428,1434,2458,2717,2953,1374,1746,4420,1848,1959,1456,2310,2840,2745,881,1531,1200,1144,1284,701,1023,1052,1012,1299,1258,1157,1815,1062,1690,1482,2135,1238,1816],"weeks":52},{"forecast_next_week":23859.0,"forecast_sd":3571.657279229007,"id":"family:Home decor","kind":"family","label":"Home decor","mean_weekly_units":14013.48076923077,"price_gbp":2.1464,"sd_weekly_units":6109.2489525578185,"weekly_units_sample":[16957,17102,4817,0,9775,12956,8463,7847,12666,5147,9917,13197,8631,9393,9363,10039,15626,10806,11482,10500,8347,9888,13662,15521,10722,10010,17021,9744,7576,8062,13543,11838,14822,12971,15276,13192,12421,14771,11757,18838,20495,25680,17875,25066,14780,25186,24741,24776,25994,24410,20460,24572],"weeks":52},{"forecast_next_week":2978.75,"forecast_sd":839.3288260099538,"id":"family:Jewellery and accessories","kind":"family","label":"Jewellery and accessories","mean_weekly_units":1970.1346153846155,"price_gbp":1.2518,"sd_weekly_units":1015.9090400236677,"weekly_units_sample":[1977,2720,771,0,2286,1246,2208,2636,722,413,1348,889,925,1138,2893,739,1538,991,704,816,706,1659,1615,1785,1365,983,2870,2538,2462,1561,1905,2659,2632,2691,1444,1477,1738,2850,1230,1847,2932,2991,3153,2552,2347,3626,5424,2530,2640,3705,3064,2506],"weeks":52},{"forecast_next_week":985.25,"forecast_sd":1058.5638782061594,"id":"sku:84077","kind":"sku","label":"84077 World War 2 Gliders Asstd Designs","mean_weekly_units":970.5576923076923,"price_gbp":0.29,"sd_weekly_units":935.3894944942755,"weekly_units_sample":[513,1173,100,0,625,289,0,530,2837,48,424,257,1680,1200,480,192,3216,392,2448,1927,2592,917,1248,1008,576,1445,480,145,961,291,1109,1104,726,823,98,577,528,1056,290,432,1296,587,1008,893,730,975,5328,974,1167,1170,915,689],"weeks":52},{"forecast_next_week":1401.0,"forecast_sd":543.8772679181761,"id":"sku:85099B","kind":"sku","label":"85099B Jumbo Bag Red Retrospot","mean_weekly_units":908.2307692307693,"price_gbp":1.95,"sd_weekly_units":497.8250978549582,"weekly_units_sample":[852,427,180,0,1374,225,594,502,965,288,985,810,624,738,1546,1379,1103,975,616,549,385,380,1206,978,933,273,883,959,841,815,1364,431,733,540,1050,1373,1356,1418,717,556,741,1667,929,2709,947,1045,600,1063,2199,1602,753,1050],"weeks":52},{"forecast_next_week":459.25,"forecast_sd":414.3590782068,"id":"sku:21212","kind":"sku","label":"21212 Pack Of 72 Retrospot Cake Cases","mean_weekly_units":676.0576923076923,"price_gbp":0.55,"sd_weekly_units":400.62326019133593,"weekly_units_sample":[1104,664,1363,0,324,618,1753,555,558,347,526,718,689,813,1303,527,785,667,598,1421,315,787,1647,598,360,229,619,856,181,123,1109,253,335,1083,445,335,1650,507,458,712,955,1028,359,477,499,503,521,1041,362,588,341,546],"weeks":52},{"forecast_next_week":888.25,"forecast_sd":490.76548358367074,"id":"sku:85123A","kind":"sku","label":"85123A White Hanging Heart T-Light Holder","mean_weekly_units":696.9038461538462,"price_gbp":2.95,"sd_weekly_units":566.904676415515,"weekly_units_sample":[1122,1529,198,0,973,3328,659,544,588,517,365,401,380,454,464,365,582,374,474,2422,375,1144,892,794,1026,629,390,391,236,258,264,1198,726,780,441,477,297,775,396,449,663,710,404,163,683,234,447,1705,594,1326,903,730],"weeks":52},{"forecast_next_week":3317.0,"forecast_sd":959.8976238652023,"id":"sku:22197","kind":"sku","label":"22197 Small Popcorn Holder","mean_weekly_units":999.0192307692307,"price_gbp":0.85,"sd_weekly_units":1008.3392187230858,"weekly_units_sample":[1012,980,252,0,807,344,261,351,107,239,1038,1312,370,779,583,237,1042,564,784,232,310,372,375,1298,4562,533,410,437,345,430,636,157,621,436,2178,1735,518,826,956,516,570,682,1675,835,884,1164,2771,1155,3900,3142,2955,3271],"weeks":52},{"forecast_next_week":1257.25,"forecast_sd":650.7143180980025,"id":"sku:84879","kind":"sku","label":"84879 Assorted Colour Bird Ornament","mean_weekly_units":668.9615384615385,"price_gbp":1.69,"sd_weekly_units":560.0379175376786,"weekly_units_sample":[781,638,40,0,472,434,139,336,937,160,588,328,213,642,968,391,585,753,815,612,264,594,1201,595,565,384,292,446,270,292,460,372,519,470,3800,1323,548,850,216,488,908,701,791,589,420,821,778,968,1740,1310,1026,953],"weeks":52},{"forecast_next_week":257.0,"forecast_sd":535.4065997057346,"id":"sku:17003","kind":"sku","label":"17003 Brocade Ring Purse","mean_weekly_units":422.0192307692308,"price_gbp":0.29,"sd_weekly_units":469.4853456914332,"weekly_units_sample":[263,90,0,0,864,8,831,1440,146,0,290,0,144,252,2196,48,769,146,73,11,267,78,510,792,793,360,913,837,864,88,318,1012,289,149,110,144,78,940,291,180,109,857,931,376,72,204,1684,100,109,315,474,130],"weeks":52},{"forecast_next_week":337.0,"forecast_sd":550.6699274709646,"id":"sku:21977","kind":"sku","label":"21977 Pack Of 60 Pink Paisley Cake Cases","mean_weekly_units":465.4807692307692,"price_gbp":0.55,"sd_weekly_units":460.5579093428102,"weekly_units_sample":[232,549,534,0,179,107,154,144,811,75,464,239,276,684,1103,408,386,158,751,1321,255,555,498,173,2825,20,337,471,545,160,117,191,1331,742,271,248,878,876,205,664,790,398,213,877,270,118,97,157,302,415,392,239],"weeks":52},{"forecast_next_week":309.0,"forecast_sd":274.0155449282303,"id":"sku:84991","kind":"sku","label":"84991 60 Teatime Fairy Cake Cases","mean_weekly_units":342.63461538461536,"price_gbp":0.55,"sd_weekly_units":236.52583731900629,"weekly_units_sample":[266,428,607,0,170,293,274,172,385,83,259,194,134,598,538,238,735,269,475,1182,246,264,532,231,301,136,90,304,94,185,645,133,124,402,245,340,648,153,141,909,733,426,220,157,193,729,437,263,196,547,357,136],"weeks":52},{"forecast_next_week":147.75,"forecast_sd":575.2767204288637,"id":"sku:15036","kind":"sku","label":"15036 Assorted Colours Silk Fan","mean_weekly_units":456.4807692307692,"price_gbp":0.83,"sd_weekly_units":551.4442887042123,"weekly_units_sample":[21,35,30,0,18,159,39,112,1913,68,762,128,91,369,1342,99,1253,147,864,174,793,972,1618,1643,397,193,1610,1285,169,167,1938,352,510,638,943,268,60,60,181,215,64,93,30,721,224,194,101,83,107,104,237,143],"weeks":52},{"forecast_next_week":776.5,"forecast_sd":423.85518333227,"id":"sku:22492","kind":"sku","label":"22492 Mini Paint Set Vintage","mean_weekly_units":498.90384615384613,"price_gbp":0.65,"sd_weekly_units":416.5801600998763,"weekly_units_sample":[1832,227,181,0,648,219,38,793,541,216,108,180,108,1261,792,252,427,324,216,800,180,216,795,469,288,108,361,761,219,72,432,794,396,252,291,180,792,324,1336,192,937,334,576,760,257,1334,792,226,1724,679,402,30